,postes,entreprises,date de publication,localités,pays concernés,categoriess,regions,contrats,experiences,diplomes,langues,salaires,fonction,Missions
136,Chef Magasinier, Confidentiel ,02/03/2023," Grand Casablanca, Maroc ", Maroc ,non spécifié, Grand Casablanca , CDI ,Experience :, Bac + 2 , Français , Negociable ,non spécifié," Gestion des équipes de magasiniers, ouvriers et caristes; Disposition des marchandises dans le magasin suivant la cartographie définie; Veille au respect des règles de sécurité stockage + travail; Veille à l’optimisation des tâches de manutention et de rangement marchandises, et du budget gasoil et réparations du matériel de manutention; "
137,Assistante Direction, Confidentiel ,02/03/2023," Grand Casablanca, Maroc ", Maroc ,non spécifié, Grand Casablanca , CDI ,Experience :, Bac + 2 , Français , Negociable ,non spécifié," Préparation et suivi des différents dossiers en liaison avec l’activité de la direction générale; Coordination avec les différentes administrations publiques ou entités privées suivant les besoins de l’activité du DG; Gestion de l’ordre du jour, planning, courrier et l’agenda du supérieur; Organisation et préparation des réunions; Contrôle et fourniture des documents nécessaires à la mission du dirigeant; Organisation des comités de direction; Coordination administrative avec les services de la société; "
138,ChargÃ©e Dâachats, Confidentiel ,02/03/2023," Grand Casablanca, Maroc ", Maroc ,non spécifié, Grand Casablanca , CDI ,Experience :, Bac + 5 , Anglais , Negociable ,non spécifié," Tenue dossiers fournisseurs : historique, encours, catégorisation; Gestion des dossiers d’achats : bons de commande, négociation secondaire (avec l’accord de la direction générale), coordination de l’approvisionnement; Analyse relations fournisseurs : concentration par article, délais, qualité, prix; Gestion des encours fournisseurs et coordination des règlements; Réclamations et gestion relations fournisseurs Offre des outils techniques pour l’analyse et l’optimisation des approvisionnements; Optimisation des stocks : calcul des seuils sur la base des prévisions de demande, historique et délais des approvisionnements; Propositions pour la réduction des coûts des approvisionnements; Maitrise des délais d’approvisionnement. "
139,Responsable IngÃ©nierie Industrielle, Confidentiel ,24/02/2023," kenitra, Maroc ", Maroc ,non spécifié, kenitra , CDI ,Experience :, Bac + 5 , Anglais , Negociable ,non spécifié," Etablir le calendrier de planification pour le déploiement de nouveaux projets d'amélioration sur la ligne-modèle Établir et suivre le plan d'action pour la mise en place de nouveaux projets d'amélioration continue. Surveiller et améliorer les indicateurs de performance de la gamme de modèles. Préparer le rapport d'examen de l'OPS"" Suivre et respecter les règles des 5s. Analyser les données de fabrication : dessin, BOM , BOL , RE Effectuez l'étude de capacité et décidez du meilleur concept de ligne en fonction de différentes entrées : volume, jours ouvrables, Préparer la subdivision de travail en fonction des opérateurs nécessaires et en suivant les règles YEL Conception de sous-ensembles en fonction de la complexité du produit Préparer la liste des équipements nécessaires par ligne Préparer la ligne de production : mise en place de la ligne Préparer les documentations de ligne Piloter et mener des activités Run & Rate Préparer le 1er projet de rapport de routage et assurer la mise à jour Assurer l'équilibrage entre les postes de travail. Prenez le temps sur les lignes identifiées et communiquez la progression de chaque ligne. Proposer et installer des améliorations pour augmenter la production. Etude de l'ergonomie des postes de travail et amélioration du workflow. Course d'EHB par ligne (sur les 5 plus mauvaises familles). Préparer le 1er projet de rapport de routage et assurer la mise à jour. Fournir une formation sur le chronométrage sur site pour ceux qui sont directement liés à l'efficacité la productivité et équilibrage (chef de produit, LL, BLC...) Gérer la définition du concept de processus dans l'usine et assurer la mise en œuvre des meilleures pratiques dans les nouvelles définitions. Fiabilité de la base de données des temps relatifs à chaque processus en coordination avec l'équipe SAP. Assurer la mise en œuvre de la bonne méthode de quantification des ECR. Contribuer activement à l'enrichissement de la PFMEA. Proposer des améliorations et les mettre en œuvre sur PFMEA "
140,Responsable Bureau D'Ã©tudes FaÃ§ade, Confidentiel ,21/02/2023," Grand Casablanca, Maroc ", Maroc ,non spécifié, Grand Casablanca , CDI ,Experience :, Bac + 2 , Français , Negociable ,non spécifié," Rattaché(e) à la direction générale, vous pilotez le bureau d'études, les chargés d'études et les dessinateurs projeteurs pour établir les études d'exécution jusqu'au lancement des travaux. "
141,Coordinateur OpÃ©rations E-commerce, Confidentiel ,21/02/2023," Grand Casablanca, Maroc ", Maroc ,non spécifié, Grand Casablanca , CDI ,Experience :, < Bac , Français , Negociable ,non spécifié, Le Coordinateur Opérations e-Commerce a pour mission le pilotage de l’ensemble des opérations en relation directe avec la livraison. Il est garant de la qualité de l’expérience client depuis la passation de commande jusqu’à la livraison. Piloter toutes les opérations qui ont un impact direct sur la livraison et assurer une bonne expérience client sur le volet de la livraison 
,postes,entreprises,date de publication,localités,pays concernés,categoriess,regions,contrats,experiences,diplomes,langues,salaires,fonction,Missions
142,ContrÃ´leur De Gestion Bi, Confidentiel ,20/02/2023," Tanger-Tétouan, Maroc ", Maroc ,non spécifié, Tanger-Tétouan , CDI ,Experience :, Bac + 5 , Anglais , Negociable ,non spécifié," Vous participez activement à la structuration des données financières du groupe et au déploiement de la stratégie de Business Intelligence (BI) de l’équipe Finance. Vous travaillez sous la responsabilité du Manager Finance Europe & Africa pour l’élaboration du reporting et des analyses des clôtures mensuelles, du budget & forecast. Vous êtes un support actif dans la réalisation de la vision et des objectifs stratégiques de l’entreprise. Vous êtes le garant du bon déroulement des clôtures mensuelles Kitchen & Bath Europe & Africa, vous assurez la fiabilité des informations comptables dans les systèmes d’information et produisez les rapports à destination de la direction générale Europe & Africa et Corporate. Vous êtes aussi le partenaire privilégié des autres services de l’entreprise (Direction générale, Direction Financière, Marketing, Supply Chain, shared services…) dans la production d’analyses permettant de prendre les meilleures décisions dans le pilotage de l’activité. Vous participez également activement aux projets d’améliorations des processus financiers à travers le développement d’outils BI adaptés. "
143,Sales Inside Anglophone, Confidentiel ,17/02/2023," kenitra, Maroc ", Maroc ,non spécifié, kenitra , CDI ,Experience :, Bac + 2 , Anglais , Negociable ,non spécifié, Accompagner les clients dans la création et le suivi des devis sur le site web Faire le suivi des devis et les transformer en commandes Augmenter le chiffre d’affaires en proposant des ventes additionnelles Détecter les clients à fort potentiel Gérer les flux des demandes entrantes 
144,Responsable ContrÃ´le De Gestion, Confidentiel ,16/02/2023," Grand Casablanca, Maroc ", Maroc ,non spécifié, Grand Casablanca , CDI ,Experience :, Bac + 5 , Français , Negociable ,non spécifié, Le responsable contrôleur de gestion a pour mission d’assurer une bonne visibilité de la rentabilité d'une entreprise et à optimiser les coûts. Il est tenu d’assister les directions de l’entreprise dans la prise de décisions stratégiques concernant l’activité de l’entreprise. 
145,Directeur Filiale H/f, Confidentiel ,16/02/2023," Grand Casablanca, Maroc ", Maroc ,non spécifié, Grand Casablanca , CDI ,Experience :, Bac + 5 , Français , Negociable ,non spécifié," Définir et mettre en place la stratégie Opérations et aligner l’organisation/culture pour atteindre et dépasser les objectifs. Garantir les résultats fixés par le client pour les indicateurs Clients-Equipes-Ventes-Profits. Elever les standards opérationnels de l’ensemble des unités Délivrer et dépasser les profits dans chaque unité. Faciliter la mise en place opérationnelle des initiatives Marketing et Promotion des Ventes. Garantir l’application des lois et standards pour tous les équipiers au sein de chaque unité (recrutement, formation, développement) Business Plan et écriture des Budgets / Politique Achat et Sourcing "
146,Auditeur Interne, Confidentiel ,15/02/2023," Grand Casablanca, Maroc ", Maroc ,non spécifié, Grand Casablanca , CDI ,Experience :, Bac + 5 , Français , Negociable ,non spécifié," L’auditeur interne a pour mission de vérifier l’exactitude des informations, organisationnelles ou financières, fournies aux dirigeants de l’entreprise. Grâce à l’audit, ils pourront définir de nouveaux objectifs ou adopter de nouvelles méthodes de travail. "
147,Informaticien En Charge De Lâexploitation , Confidentiel ,09/02/2023," Grand Casablanca, Maroc ", Maroc ,non spécifié, Grand Casablanca , CDI ,Experience :, Bac + 5 , Français , Negociable ,non spécifié," Administration et la sécurité de la plateforme technique SAP : SAP BC, Base Oracle, Sauvegardes, Systèmes d’exploitation, virtualisation et HPE Blade ; Maintien en conditions opérationnelles des instances SAP et des serveurs applicatifs ; Contrôles quotidiens des systèmes SAP ; Contrôle des performances des systèmes SAP ; Analyse et suivi des incidents techniques SAP & amélioration continue ; Gestion des environnements SAP : "" DEV "", "" QUAL "" et "" PROD "" ; Configuration et gestion des jobs ; Configuration et gestion des transports (TMS) vers SAP (gestion des comptes, gestion des référentiels, accès et habilitations, etc.) ; Programmation ABAP pour la maintenance des développements spécifiques ; Réalisation d’applications spécifiques SAP en ABAP ; Surveillance des backups ; Rédaction des procédures d’exploitation et des dossiers d’analyse des développements spécifiques ; Support technique aux utilisateurs autour de la solution SAP ; "
148,Assistante De Direction Commerciale, Confidentiel ,06/02/2023," Grand Casablanca, Maroc ", Maroc ,non spécifié, Grand Casablanca , CDI ,Experience :, Bac + 4 , Français , Negociable ,non spécifié," Accompagner le Directeur Commercial et Marketing dans l’optimisation de sa gestion et de ses engagements internes et externes. Assurer la circulation de l’information entre le Directeur Commercial et Marketing et les différents services, et équipes. Coordonner avec le Directeur Commercial et Marketing les activités de promotion de la société (Salons, Voyages, Evénements….). Préparer le Reporting mensuel des résultats commerciaux Maroc & reste Maghreb. Tenir à jour une base de données d’offres chantiers en cours de prospection ou en cours de négociation. "
149,Commercial Bois/derive , Confidentiel ,31/01/2023," Grand Casablanca, Maroc ", Maroc ,non spécifié, Grand Casablanca , CDI ,Experience :, Bac + 5 , Français , Negociable ,non spécifié," Assurer la prospection et le développement du portefeuille client en élaborant un plan de prospection Anticiper et susciter les besoins de la clientèle Organiser son travail en fonction d’objectifs commerciaux définis par la direction Définir son planning de visite Présenter les produits au client Conseiller, argumenter et répondre aux objections en présentant rapidement des arguments persuasifs Conclure les ventes par l’établissement de bons de commande Assurer le suivi commercial et administratif de sa clientèle Faire preuve de résistance en cas d’échecs répétés liés au mode de démarchage Développer et maintenir ses connaissances concernant la concurrence (produits, financement, prix ……) Se tenir au courant des évolutions techniques "
150,Photographe-videaste, Confidentiel ,31/01/2023," Rabat-Salé-Kenitra-Zemmour-Zaër, Maroc ", Maroc ,non spécifié, Rabat-Salé-Kenitra-Zemmour-Zaër , CDI ,Experience :, Bac + 3 , Français , Negociable ,non spécifié," Placé sous l'autorité du responsable du service Éditions et information, il a en charge la production et la réalisation de vidéos adaptées aux objectifs fixés et aux supports de communication. "
151,Key Account Manager, Confidentiel ,31/01/2023," Marrakech-Tensift-El Haouz, Maroc ", Maroc ,non spécifié, Marrakech-Tensift-El Haouz , CDI ,Experience :, Bac + 5 , Français , Negociable ,non spécifié," Elaboration et mise en place de la stratégie commerciale pour les comptes clés. Définition des plateformes de croissance pour les comptes clés. Revue mensuelle, trimestrielle et annuelle des performances des comptes clés. Négociation des contrats avec les centrales d’achats. Pilotage des prévisions des ventes par marque, par enseigne et par mois. Mise en place des plans promotionnels et d’activation annuels ; Suivi du budget et de la profitabilité des comptes clés. Formation des Vendeurs et monitoring de l'exécution… "
152,TrÃ©sorier, Confidentiel ,31/01/2023," Grand Casablanca, Maroc ", Maroc ,non spécifié, Grand Casablanca , CDI ,Experience :, Bac + 5 , Français , Negociable ,non spécifié," Le trésorier est responsable de la gestion des liquidités, des placements et des risques de l’entreprise liés aux activités financières de l’entreprise. "
153,Chef De Projet Pilotage / ResponsabilitÃ© SociÃ©tale Des Entreprises , Confidentiel ,19/01/2023," Rabat-Salé-Kenitra-Zemmour-Zaër, Maroc ", Maroc ,non spécifié, Rabat-Salé-Kenitra-Zemmour-Zaër , CDI ,Experience :, Bac + 5 , Anglais , Negociable ,non spécifié, Participer à la déclinaison du plan stratégique en objectifs/ feuilles de route et suivre leur mise en œuvre Assurer la bonne tenue des instances de gouvernance et d’animation de Client 
154,Responsable De Location, Confidentiel ,17/01/2023," Tanger-Tétouan, Maroc ", Maroc ,non spécifié, Tanger-Tétouan , CDI ,Experience :, Bac + 4 , Français , Negociable ,non spécifié," La mission du Responsable de location est de conseiller le client, d’établir les offres de service et de vente, D’établir les contrats de location, de veiller à leur bonne exécution et d’enregistrer la satisfaction du client. "
155,Chef De Projet Informatique, Confidentiel ,16/01/2023," Grand Casablanca, Maroc ", Maroc ,non spécifié, Grand Casablanca , CDI ,Experience :, Bac + 5 , Français , Negociable ,non spécifié," Le chef de projet informatique a pour mission de diriger une équipe et superviser les étapes successives de la vie d'un projet informatique, pour répondre aux besoins des clients interne en gérant les ressources humaines et matérielles nécessaires. Il est aussi appelé à traduire les demandes des différents départements à une solution informatique adaptée en les assistant dans la définition de leurs besoins. "
156,ChargÃ© Administration Des Ventes ( Tanger ) , Confidentiel ,04/01/2023," Tanger-Tétouan, Maroc ", Maroc ,non spécifié, Tanger-Tétouan , CDI ,Experience :, Bac + 2 , Français , Negociable ,non spécifié, Assurer la gestion et l'audit des fiches et dossiers clients Vérifier et assurer le suivi des paiements / Recouvrement Participer aux livraisons définitives des projets sur le volet administratif Saisir les données administratives et commerciales sur les reportings Assurer le classement des dossiers physiques et électroniques 
157,Acheteur Living, Confidentiel ,02/01/2023," Grand Casablanca, Maroc ", Maroc ,non spécifié, Grand Casablanca , CDI ,Experience :, Bac + 5 , Anglais , Negociable ,non spécifié," Notre client est un groupe évoluant dans la distribution, reconnu comme un acteur majeur dans son domaine recrute un Acheteur Living et Ameublement qui sera responsable du chiffre d’affaires et de la rentabilité de la catégorie de produits qui lui sont affectés. "
158,Chef Du Service Achats, Confidentiel ,28/12/2022," Grand Casablanca, Maroc ", Maroc ,non spécifié, Grand Casablanca , CDI ,Experience :, Bac + 5 , Français , Negociable ,non spécifié," Le Chef du Service Achats est chargé, à court et moyen terme, de la satisfaction dans les meilleures conditions des besoins d’achats locaux et à l’import de l’entreprise. "
159,Agent Administration Des Ventes ( H/f ) , Confidentiel ,26/12/2022," Grand Casablanca, Maroc ", Maroc ,non spécifié, Grand Casablanca , CDI ,Experience :, Bac + 3 , Français , Negociable ,non spécifié, Votre principale mission consiste à organiser et réaliser la gestion administrative totale du cycle de vente/location depuis la demande d’offre jusqu’à la finalisation du projet. 
160,Chef De Projet DÃ©veloppement Durable, Confidentiel ,22/12/2022," Rabat-Salé-Kenitra-Zemmour-Zaër, Maroc ", Maroc ,non spécifié, Rabat-Salé-Kenitra-Zemmour-Zaër , CDI ,Experience :, Bac + 5 , Français , Negociable ,non spécifié," Fédérer les entités internes, les acteurs territoriaux et nationaux ainsi que l’ensemble des parties prenantes pour contribuer au développement durable des Territoires, notamment les acteurs des territoires d’implantation des projets énergétiques. "
161,Responsable SystÃ¨me D'information Et RÃ©seaux., Confidentiel ,22/12/2022," Grand Casablanca, Maroc ", Maroc ,non spécifié, Grand Casablanca , CDI ,Experience :, Bac + 5 , Français , Negociable ,non spécifié," Rattaché à la direction support, vous êtes en charge de : Installation et administration des systèmes d'exploitation. Supervision et administration des systèmes de stockage, de sauvegarde et de restauration Gestion de la messagerie et de l'antivirus Installation et déploiement de serveurs physiques et virtuels Installation, configuration et maintenance des postes , des serveurs et des équipements réseaux Supervision du bon fonctionnement des caméras de surveillance, de la téléphonie fixe et mobile Maintien à jour de la documentation interne décrivant l'architecture du système informatique et les procédures associées Mise en œuvre, exploitation, maintenance et administration des différents éléments de sécurité SI (pare-feu, mécanismes/équipements d'authentification et de chiffrement…) Développement des tableaux de bord Support aux utilisateurs. "
162,RÃdacteur Web Francophone, Confidentiel ,22/12/2022," Rabat-Salé-Kenitra-Zemmour-Zaër, Maroc ", Maroc ,non spécifié, Rabat-Salé-Kenitra-Zemmour-Zaër , CDI ,Experience :, Bac + 3 , Anglais , Negociable ,non spécifié," Assurer La rédaction de tous types de contenus notamment en langue française : articles du portail de la Fondation Hassan II, Centre Culturel Virtuel : e-taqafa, espace rivages (évènement artistique et/ou culturel) ; Rendre clairs et concis, auprès de notre cible, des contenus existants en intégrant textes, images et vidéos ; La relecture et la correction de tous types de contenus ; Respecter rigoureusement les délais impartis pour la réalisation de chaque travail ; Assurer une veille technologique régulière afin de pouvoir s'adapter aux nouvelles contraintes de son métier. Participer à l’élaboration de la stratégie éditoriale : Création des contenus sous divers formats // proposer des sujets d’articles et des thèmes Créer de la valeur ajoutée en respectant les normes de l’écriture Web Promouvoir des contenus publiés Avoir une veille approfondie sur les sujets d’expertise de nos clients Rédiger l'information en la rendant accessible Relayer les contributions, avis, remarques et suggestions des membres de la communauté "
163,Responsable Supply Chain, Confidentiel ,22/12/2022," Grand Casablanca, Maroc ", Maroc ,non spécifié, Grand Casablanca , CDI ,Experience :, Bac + 5 , Français , Negociable ,non spécifié," Définit et met en œuvre avec chacune de ses équipes : achat, logistique, ordonnancement des plans d’action permettant pour le site d’atteindre les objectifs définis avec la Direction et de s’inscrire par ailleurs dans un processus d’amélioration. Supervise la réalisation des objectifs et définit toute action corrective nécessaire en cas de dérive en relation avec les services de production ou contrôle de gestion. Identifie des opportunités de progrès et propose /implémente des projets. En charge des négociations d’achat en relation avec les services centraux. (Approvisionnement et investissements), . Assure la gestion et l’optimisation des flux avec les sous-traitants. Développe les systèmes d’informations liés à la supplychain. Suit les Non-conformité Fournisseurs. Assure l’optimisation des stocks (stocks de sécurité). Responsable de la démarche d’amélioration continue du pilier Supply Chain Prépare le reporting Achat (Economie sur dépenses et investissements) de la Société. "
164,Directeur Administratif Et Financier, Confidentiel ,22/12/2022," Grand Casablanca, Maroc ", Maroc ,non spécifié, Grand Casablanca , CDI ,Experience :, Bac + 5 , Anglais , Negociable ,non spécifié, Assurer et superviser la gestion administrative et financière de la structure selon le cadre règlementaire et les choix stratégiques définis par la Direction Générale ; Etre Business Partner financier(ère) en lien avec les responsables opérationnels pour son activité. 
165,ContrÃ´leur De Gestion Senior, Confidentiel ,22/12/2022," Grand Casablanca, Maroc ", Maroc ,non spécifié, Grand Casablanca , CDI ,Experience :, Bac + 5 , Français , Negociable ,non spécifié," Fiabiliser les comptes du périmètre Préparer et animer les réunions d’arrêtés des comptes mensuels avec les directeurs d’agence et de région Effectuer le contrôle budgétaire des frais généraux locaux Assurer le respect des obligations légales, administratives et réglementaires Superviser les fonctions administratives et financières des chantiers : facturation clients, provisions et rapprochement des factures fournisseurs, trésorerie, contrôle de gestion… Gérer les équipes dont vous aurez la charge Accompagner les exploitants sur toutes les problématiques de gestion qu’ils peuvent rencontrer Remonter les éléments de reporting du périmètre au D.A.F. L’appétence pour le travail collaboratif avec les opérationnels est une condition essentielle de réussite à ce poste. "
166,Responsable Ressources Humaines, Confidentiel ,22/12/2022," Grand Casablanca, Maroc ", Maroc ,non spécifié, Grand Casablanca , CDI ,Experience :, Bac + 5 , Français , Negociable ,non spécifié," En tant que Responsable Ressources Humaines, vous aurez un rôle déterminant dans la gestion quotidienne de la société, d’un point de vue administratif et opérationnel en assurant le support de la direction générale sur différents sujets "
167,Auditeur Interne, Confidentiel ,19/12/2022," Grand Casablanca, Maroc ", Maroc ,non spécifié, Grand Casablanca , CDI ,Experience :, Bac + 5 , Français , Negociable ,non spécifié," Rattaché à la Direction Générale, vous préparez et réalisez les missions d’audit visant à améliorer les méthodes de travail et traquer les risques financiers et opérationnels. "
168,Directeur De Production, Confidentiel ,05/12/2022," Grand Casablanca, Maroc ", Maroc ,non spécifié, Grand Casablanca , CDI ,Experience :, Bac + 5 , Français , Negociable ,non spécifié," Élaboration du programme de production en fonction des besoins commerciaux et des contraintes (techniques, matières premières, délais, stocks.....) ; Recherche de solutions visant à augmenter le taux de rendement global et à optimiser la consommation des ressources. Organisation et gestion de la production (nouveaux processus, nouvelle organisation fonctionnelle, etc...) Établissement des plans d'approvisionnement (quantités, volumes, rythme de production) pour les différentes familles de produit Recommandation des mesures d'optimisation et d'amélioration des procédés de production existants Identification des dysfonctionnements et des imprévues productions et apports des solutions adéquates Définition et suivi de l'évolution des indicateurs de performance de production Assurer un reporting régulier à la Direction Générale et au comité de direction Garantie du bon fonctionnement de la chaine de production Animation des groupes de travail dans le cadre des projets destinés à améliorer la production Proposition des investissements qui permettront d'améliorer la production Planification de la production dans le respect des nomenclatures Supervision et suivi de l'application des instructions d'hygiène et de sécurité Gestion d'équipe des ingénieurs responsables des différents ateliers de production "
